{
  "$schema": "https://json-schema.org/draft/2020-12/schema",
  "$id": "https://veyora.invalid/contracts/web/security-headers-v1.schema.json",
  "type": "object",
  "additionalProperties": false,
  "required": [
    "schema_version",
    "headers",
    "forbidden"
  ],
  "properties": {
    "schema_version": {
      "const": 1
    },
    "headers": {
      "type": "object"
    },
    "forbidden": {
      "type": "array",
      "minItems": 1,
      "items": {
        "type": "string"
      }
    },
    "rendering_notes": {
      "type": "string"
    }
  }
}
